{
  "schema_version": 1,
  "bundle_id": "bundle-att-T19-C001",
  "attempt_id": "att-T19-C001",
  "created_at": "2026-09-15T17:01:16+09:00",
  "root_path": "/home/vimkim/.cub/campaign/cbrd-26659/ticket19/attempts/inv-T19-C001",
  "total_bytes": 74219,
  "complete": true,
  "items": {
    "workload": {
      "state": "present",
      "path": "workload.sql",
      "hash": "sha256:3d125c6dd6610c4f5c77508cf93a89966b9b10ae108871888f7c84c6b52a243f",
      "note": "the case file as executed (testcase commit 0eb64fc87)"
    },
    "seed_and_generator_version": {
      "state": "not-applicable",
      "path": null,
      "hash": null,
      "note": "fixed deterministic workload; no generator and no seed"
    },
    "session_and_barrier_trace": {
      "state": "not-applicable",
      "path": null,
      "hash": null,
      "note": "single-session SQL case: no barrier to acknowledge"
    },
    "injection_acknowledgements": {
      "state": "not-applicable",
      "path": null,
      "hash": null,
      "note": "unmodified engine, no fault armed"
    },
    "engine_identity": {
      "state": "present",
      "path": "identity.txt",
      "hash": "sha256:1958d208a5df5e323fedfd51d504c941e9a2f557b0e25d92ba0ee9da455eea9f",
      "note": "baseline commit, install prefix, cubrid_rel, library sha256 values verified against ticket 11 before the launcher started"
    },
    "testcase_identity": {
      "state": "present",
      "path": "identity.txt",
      "hash": "sha256:1958d208a5df5e323fedfd51d504c941e9a2f557b0e25d92ba0ee9da455eea9f",
      "note": "repository testcases, branch, commit 0eb64fc87, base commit b94995abf"
    },
    "specification_identity": {
      "state": "present",
      "path": "identity.txt",
      "hash": "sha256:1958d208a5df5e323fedfd51d504c941e9a2f557b0e25d92ba0ee9da455eea9f",
      "note": "context revision and content hash, catalogue hash"
    },
    "build_and_configuration_identity": {
      "state": "present",
      "path": "sql_inv-T19-C001.conf",
      "hash": "sha256:e31a4720abb8c0431e7a585e4eca77ce84f63756c7555f5ff4d03195c9bbe14a",
      "note": "the CTP SQL configuration used (createdb options set the 16384 B page size; ports); release build, client-server"
    },
    "instrumentation_identity": {
      "state": "not-applicable",
      "path": null,
      "hash": null,
      "note": "unmodified engine; no instrumentation worktree"
    },
    "fixture_identity": {
      "state": "present",
      "path": "identity.txt",
      "hash": "sha256:1958d208a5df5e323fedfd51d504c941e9a2f557b0e25d92ba0ee9da455eea9f",
      "note": "CTP database `basic` created with --db-volume-size=128M --log-volume-size=64M --db-page-size=16384 --log-page-size=16384 under the campaign-private CUBRID_DATABASES named in identity.txt"
    },
    "expected_versus_actual": {
      "state": "present",
      "path": "expected_vs_actual.diff",
      "hash": "sha256:0de0053fd1486637e474b2cd7f2f4edb2c4dc028283cf6175782c9556b9baa6d",
      "note": "answer versus result: MISMATCH; expected.answer and the retained result file sit beside it"
    },
    "logs": {
      "state": "present",
      "path": "ctp.log",
      "hash": "sha256:cb75119eb9442963753f19d7bab7013e3995674affde64517cac37cbcc6b309e",
      "note": "the launcher transcript (setup, discovery, execution, do_clean); ctp_result/ holds main.info and summary.info"
    },
    "cores": {
      "state": "not-applicable",
      "path": null,
      "hash": null,
      "note": "no core file: the launcher's core scan found none (it proceeded to do_clean)"
    },
    "replay_command_with_prerequisites": {
      "state": "present",
      "path": "replay.sh",
      "hash": "sha256:2e33580936dc3e0c9953c26c3e76049940d4d7b25e78bcec480a4c1733446e56",
      "note": "the replay command and the prerequisites it does not create (pinned install with the JDBC client artifact, CTP, the testcase worktree at the recorded commit, free campaign ports, unprivileged user namespaces)"
    }
  },
  "uncommitted_snapshots": [
    {
      "what": "OOS-CONTEXT.md at the pinned content hash (uncommitted in the context repository at pin time, ticket 11 section 3)",
      "path": "cbrd-26659/campaign/ticket11-evidence/normative-snapshot/OOS-CONTEXT.md",
      "hash": "sha256:c9daf3c4ed25e16356ebf3c79c55f6bb7391d76c5664675a9aaf55cd5ac11698"
    }
  ],
  "retention": {
    "class": "success-bulky",
    "expires_on": "2026-09-22",
    "hold_reason": null
  },
  "minimization": null
}
