{
  "schema_version": 1,
  "bundle_id": "bundle-att-EXAMPLE-0001",
  "attempt_id": "att-EXAMPLE-0001",
  "created_at": "2026-09-10T18:00:41+09:00",
  "root_path": "/home/vimkim/.cub/campaign/cbrd-26659/bundles/att-EXAMPLE-0001",
  "total_bytes": 184320,
  "complete": false,
  "items": {
    "workload": {
      "state": "present",
      "path": "workload/example_rep02_largest_first.sql",
      "hash": "sha256:e5ef633cb73882ef40d9d407dd8575482481e45280b0aba74dacd87dca7395d8",
      "note": null
    },
    "seed_and_generator_version": {
      "state": "not-applicable",
      "path": null,
      "hash": null,
      "note": "fixed deterministic case"
    },
    "session_and_barrier_trace": {
      "state": "not-applicable",
      "path": null,
      "hash": null,
      "note": "single session"
    },
    "injection_acknowledgements": {
      "state": "not-applicable",
      "path": null,
      "hash": null,
      "note": "unmodified engine, no faults armed"
    },
    "engine_identity": {
      "state": "present",
      "path": "identity/engine.txt",
      "hash": "sha256:df58a773eb80adc7c8e6f7bb6b85f90e65c8e32122163f4206d2b313a34992bc",
      "note": null
    },
    "testcase_identity": {
      "state": "present",
      "path": "identity/testcase.txt",
      "hash": "sha256:7b121db38de17afcce8ffa8a8ac8f158820303353eca2eecd81352a1441cece1",
      "note": null
    },
    "specification_identity": {
      "state": "present",
      "path": "identity/specification.txt",
      "hash": "sha256:8460e3b5d97ccd896cdb3ef3b1ddc2df93dc8eb60727727cef4eabf51a48367a",
      "note": null
    },
    "build_and_configuration_identity": {
      "state": "present",
      "path": "identity/build-config.txt",
      "hash": "sha256:fa4f8ff5c9e6249c0f7df3605751520472927d6726834609c2f3d8dff8cafe0d",
      "note": null
    },
    "instrumentation_identity": {
      "state": "not-applicable",
      "path": null,
      "hash": null,
      "note": "unmodified engine"
    },
    "fixture_identity": {
      "state": "present",
      "path": "fixture/createdb.txt",
      "hash": "sha256:0d81b21d2b115fab5fde999d0a8b720122818660b71473c10b323c5d63590439",
      "note": null
    },
    "expected_versus_actual": {
      "state": "present",
      "path": "compare/result-vs-answer.diff",
      "hash": "sha256:ebceb585ea8abf5c875c45445dad4ea245836046df6109d7f83a72a8d3b6b2cd",
      "note": null
    },
    "logs": {
      "state": "present",
      "path": "logs/",
      "hash": "sha256:2beb4a5283f1446fb6d701741cd7282190c2677eac155e3e8f996b1e7cf664ed",
      "note": null
    },
    "cores": {
      "state": "not-applicable",
      "path": null,
      "hash": null,
      "note": "no process crashed"
    },
    "replay_command_with_prerequisites": {
      "state": "missing",
      "path": null,
      "hash": null,
      "note": "replay wrapper not yet written (ticket 15); command recorded by hand in the attempt record notes only"
    }
  },
  "uncommitted_snapshots": [
    {
      "what": "OOS-CONTEXT.md working copy at pin",
      "path": "snapshots/OOS-CONTEXT.md",
      "hash": "sha256:c9daf3c4ed25e16356ebf3c79c55f6bb7391d76c5664675a9aaf55cd5ac11698"
    }
  ],
  "retention": {
    "class": "success-bulky",
    "expires_on": "2026-09-17",
    "hold_reason": null
  },
  "minimization": null
}
